{
  "schemaVersion": "1.0.0",
  "kind": "enchantmentItemDefinition",
  "enchantmentItemDefinitionId": 1,
  "enchantmentDefinitionId": 1,
  "level": 1,
  "rarityTier": 2,
  "burnOnUse": true,
  "enabled": true,
  "name": "Fire Edge Item",
  "metadataRevision": 1,
  "verificationStatus": "confirmed",
  "notes": "Synced from live CityEnchantmentItems."
}
